tweet,created_at,tokens,sentiment,sentiment_prob
kang dedi mulyadi wlgyt bawa piala malam baeksang congrats warga jeruk keprok best drama best screenplay best supporting actor best supporting actress,Mon May 05 15:38:39 +0000 2025,"['kang', 'dedi', 'mulyadi', 'wlgyt', 'bawa', 'piala', 'malam', 'baeksang', 'congrats', 'warga', 'jeruk', 'keprok', 'best', 'drama', 'best', 'screenplay', 'best', 'supporting', 'actor', 'best', 'supporting', 'actress']",netral,"[0.0007795051205903292, 0.9990915060043335, 0.00012904196046292782]"
kang dedi mulyadi harbin menang grand prize daesang cinematography best movie acara baeksang arts awards selamat tim harbin,Mon May 05 15:09:56 +0000 2025,"['kang', 'dedi', 'mulyadi', 'harbin', 'menang', 'grand', 'prize', 'daesang', 'cinematography', 'best', 'movie', 'acara', 'baeksang', 'arts', 'awards', 'selamat', 'tim', 'harbin']",netral,"[0.0008893480990082026, 0.9989511966705322, 0.00015943049220368266]"
bilang tiru dll dedimulyadi jokowi kang dedi mulyadi milu bansosnya dibanyakin mah bansos bikin maju ambruk,Mon May 05 13:06:50 +0000 2025,"['bilang', 'tiru', 'dll', 'dedimulyadi', 'jokowi', 'kang', 'dedi', 'mulyadi', 'milu', 'bansosnya', 'dibanyakin', 'mah', 'bansos', 'bikin', 'maju', 'ambruk']",negatif,"[5.013212648918852e-05, 0.00017878750804811716, 0.9997710585594177]"
kang dedi mulyadi selamat best actor best actress baeksang kategori dramatv pairing next project mumpung tarik ambil meloheavy melo calling to all pdnim,Mon May 05 15:55:43 +0000 2025,"['kang', 'dedi', 'mulyadi', 'selamat', 'best', 'actor', 'best', 'actress', 'baeksang', 'kategori', 'dramatv', 'pairing', 'next', 'project', 'mumpung', 'tarik', 'ambil', 'meloheavy', 'melo', 'calling', 'to', 'all', 'pdnim']",netral,"[0.006389191839843988, 0.9932047128677368, 0.0004061368526890874]"
kang dedi mulyadi pilih guys duaduanya suzy,Mon May 05 15:12:02 +0000 2025,"['kang', 'dedi', 'mulyadi', 'pilih', 'guys', 'duaduanya', 'suzy']",netral,"[0.16954615712165833, 0.8294413089752197, 0.0010124783730134368]"
kang dedi mulyadi congratss culinary class war menang daesang,Mon May 05 15:02:33 +0000 2025,"['kang', 'dedi', 'mulyadi', 'congratss', 'culinary', 'class', 'war', 'menang', 'daesang']",netral,"[0.0024116868153214455, 0.9973207116127014, 0.000267598225036636]"
sender sedih bogum menang mewek lihat senyum kaya gin gapapa moga menang next year good boy kang dedi mulyadi,Mon May 05 15:51:36 +0000 2025,"['sender', 'sedih', 'bogum', 'menang', 'mewek', 'lihat', 'senyum', 'kaya', 'gin', 'gapapa', 'moga', 'menang', 'next', 'year', 'good', 'boy', 'kang', 'dedi', 'mulyadi']",negatif,"[0.3691200911998749, 0.0431622676551342, 0.5877176523208618]"
ada pimpin daerah lampau kang dedi mulyadi pramono anung helikopter banjir rano karno layan warga timpa bencana banjir,Mon May 05 12:35:28 +0000 2025,"['ada', 'pimpin', 'daerah', 'lampau', 'kang', 'dedi', 'mulyadi', 'pramono', 'anung', 'helikopter', 'banjir', 'rano', 'karno', 'layan', 'warga', 'timpa', 'bencana', 'banjir']",netral,"[0.00016974637401290238, 0.9996802806854248, 0.00014998063852544874]"
kang dedi mulyadi tebak,Mon May 05 15:40:31 +0000 2025,"['kang', 'dedi', 'mulyadi', 'tebak']",netral,"[0.0012840644922107458, 0.9985529780387878, 0.00016300685820169747]"
mnurutku salty kang dedi mulyadi konten deh unstoppable bahan konten emang karna daerah fairly smoga baik warga belio,Mon May 05 15:52:08 +0000 2025,"['mnurutku', 'salty', 'kang', 'dedi', 'mulyadi', 'konten', 'deh', 'unstoppable', 'bahan', 'konten', 'emang', 'karna', 'daerah', 'fairly', 'smoga', 'baik', 'warga', 'belio']",positif,"[0.9966868758201599, 0.001452132361009717, 0.0018610254628583789]"
kayak lihat video kang dedi mulyadi isi ngehidupin skill udah ilang skill bahasa sunda,Mon May 05 15:04:38 +0000 2025,"['kayak', 'lihat', 'video', 'kang', 'dedi', 'mulyadi', 'isi', 'ngehidupin', 'skill', 'udah', 'ilang', 'skill', 'bahasa', 'sunda']",negatif,"[0.0008088659960776567, 0.3241617977619171, 0.6750293374061584]"
guys lihat guys couple upcoming kang dedi mulyadi daegun buin interaksi baeksang moga foto omg sabar drama iu byeon wooseok,Mon May 05 15:32:31 +0000 2025,"['guys', 'lihat', 'guys', 'couple', 'upcoming', 'kang', 'dedi', 'mulyadi', 'daegun', 'buin', 'interaksi', 'baeksang', 'moga', 'foto', 'omg', 'sabar', 'drama', 'iu', 'byeon', 'wooseok']",netral,"[0.0006324481219053268, 0.9991078972816467, 0.00025967974215745926]"
lagilagi gubernur jawa barat dedi mulyadi sorot kali bijak kirim siswa nakal barak militer menteri ham natalius pigai bilang langgar ham dapat ketua komnas ham hah gimana tuh a thread dedimulyadi,Mon May 05 14:26:48 +0000 2025,"['lagilagi', 'gubernur', 'jawa', 'barat', 'dedi', 'mulyadi', 'sorot', 'kali', 'bijak', 'kirim', 'siswa', 'nakal', 'barak', 'militer', 'menteri', 'ham', 'natalius', 'pigai', 'bilang', 'langgar', 'ham', 'dapat', 'ketua', 'komnas', 'ham', 'hah', 'gimana', 'tuh', 'a', 'thread', 'dedimulyadi']",netral,"[0.00044833015999756753, 0.7920063138008118, 0.20754532516002655]"
rada kaharti lamun kang dedi mulyadi ayeuna bahan obroleun loba jelema babeh aing imah ge ti saprak pengsiun osok mantau yutub kang dedi mulyadi branding kang dedi mulyadi kuat pis komo baheula ti jaman manehna bupati amp urg kkn nya adnanfahmy,Mon May 05 13:20:42 +0000 2025,"['rada', 'kaharti', 'lamun', 'kang', 'dedi', 'mulyadi', 'ayeuna', 'bahan', 'obroleun', 'loba', 'jelema', 'babeh', 'aing', 'imah', 'ge', 'ti', 'saprak', 'pengsiun', 'osok', 'mantau', 'yutub', 'kang', 'dedi', 'mulyadi', 'branding', 'kang', 'dedi', 'mulyadi', 'kuat', 'pis', 'komo', 'baheula', 'ti', 'jaman', 'manehna', 'bupati', 'amp', 'urg', 'kkn', 'nya', 'adnanfahmy']",positif,"[0.9857191443443298, 0.010494556277990341, 0.003786269575357437]"
kang dedi mulyadi k stand for k sila lanjut main game lho tertawa lu sembah kereta kencana larang ya bodat,Mon May 05 13:51:36 +0000 2025,"['kang', 'dedi', 'mulyadi', 'k', 'stand', 'for', 'k', 'sila', 'lanjut', 'main', 'game', 'lho', 'tertawa', 'lu', 'sembah', 'kereta', 'kencana', 'larang', 'ya', 'bodat']",negatif,"[0.000435617781477049, 0.0032076025381684303, 0.9963567852973938]"
mention pribumi tertawa tai tai kemarin anis goreng mention pribumi kang dedi mulyadi mention pribumi nyepong,Mon May 05 14:27:29 +0000 2025,"['mention', 'pribumi', 'tertawa', 'tai', 'tai', 'kemarin', 'anis', 'goreng', 'mention', 'pribumi', 'kang', 'dedi', 'mulyadi', 'mention', 'pribumi', 'nyepong']",negatif,"[0.0028674474451690912, 0.4224453866481781, 0.5746871829032898]"
oomf dukung program fasis kang dedi mulyadi ngirim bocil barak persekusi lgbt sila bub i dont need a fascist enabler like you selamat kontribusi bubar indonesia,Mon May 05 13:56:06 +0000 2025,"['oomf', 'dukung', 'program', 'fasis', 'kang', 'dedi', 'mulyadi', 'ngirim', 'bocil', 'barak', 'persekusi', 'lgbt', 'sila', 'bub', 'i', 'dont', 'need', 'a', 'fascist', 'enabler', 'like', 'you', 'selamat', 'kontribusi', 'bubar', 'indonesia']",negatif,"[0.00048506411258131266, 0.12352069467306137, 0.8759942054748535]"
dedi mulyadi tuh k nya apasih sebut kang dedi mulyadi kang dedi mulyadi kon,Mon May 05 10:33:48 +0000 2025,"['dedi', 'mulyadi', 'tuh', 'k', 'nya', 'apasih', 'sebut', 'kang', 'dedi', 'mulyadi', 'kang', 'dedi', 'mulyadi', 'kon']",netral,"[0.18786583840847015, 0.6775368452072144, 0.1345973014831543]"
netizen twitter cerdas terima nyata kang dedi mulyadi hasil nyentuh grassroot yak gua sisa ruang suuzon nama jg politik lupa pandang pimpin sesuai batas agama jalan seharihari gimana kiprah,Mon May 05 13:44:05 +0000 2025,"['netizen', 'twitter', 'cerdas', 'terima', 'nyata', 'kang', 'dedi', 'mulyadi', 'hasil', 'nyentuh', 'grassroot', 'yak', 'gua', 'sisa', 'ruang', 'suuzon', 'nama', 'jg', 'politik', 'lupa', 'pandang', 'pimpin', 'sesuai', 'batas', 'agama', 'jalan', 'seharihari', 'gimana', 'kiprah']",positif,"[0.8754600286483765, 0.11918599158525467, 0.005353989079594612]"
orimen bwahahaha kamiseven goodluck maksa mayuyu muncul,Mon May 05 12:01:45 +0000 2025,"['orimen', 'bwahahaha', 'kamiseven', 'goodluck', 'maksa', 'mayuyu', 'muncul']",netral,"[0.0001206287561217323, 0.9993335604667664, 0.0005457247607409954]"
nada omong kang dedi mulyadi w curiga zhil org dalem,Mon May 05 12:44:01 +0000 2025,"['nada', 'omong', 'kang', 'dedi', 'mulyadi', 'w', 'curiga', 'zhil', 'org', 'dalem']",negatif,"[5.913105633226223e-05, 0.0035927824210375547, 0.9963480830192566]"
kim taeri menang best actress drama baeksang arts awards kang dedi mulyadi,Mon May 05 14:41:57 +0000 2025,"['kim', 'taeri', 'menang', 'best', 'actress', 'drama', 'baeksang', 'arts', 'awards', 'kang', 'dedi', 'mulyadi']",netral,"[0.00041764412890188396, 0.9994437098503113, 0.00013867989764548838]"
kang dedi mulyadi ok guys drop foto ootd fav dri baeksang tdi lihat si cantik ganteng pakai gaun or suit tsb heres mine,Mon May 05 14:44:44 +0000 2025,"['kang', 'dedi', 'mulyadi', 'ok', 'guys', 'drop', 'foto', 'ootd', 'fav', 'dri', 'baeksang', 'tdi', 'lihat', 'si', 'cantik', 'ganteng', 'pakai', 'gaun', 'or', 'suit', 'tsb', 'heres', 'mine']",positif,"[0.9495162963867188, 0.0423218235373497, 0.008161879144608974]"
duduk kantor selesai kang dedi king dedi,Mon May 05 14:15:30 +0000 2025,"['duduk', 'kantor', 'selesai', 'kang', 'dedi', 'king', 'dedi']",netral,"[0.0009278334327973425, 0.9980778694152832, 0.0009943312034010887]"
kang dedi mulyadi congrats to kim taeri ju jihoon yok main drama bareng deserve,Mon May 05 14:42:06 +0000 2025,"['kang', 'dedi', 'mulyadi', 'congrats', 'to', 'kim', 'taeri', 'ju', 'jihoon', 'yok', 'main', 'drama', 'bareng', 'deserve']",netral,"[0.0007310890941880643, 0.9990931749343872, 0.00017581615247763693]"
kang dedi mulyadi congratsss ju jihoon kim taeri menang best actor best actress,Mon May 05 14:49:40 +0000 2025,"['kang', 'dedi', 'mulyadi', 'congratsss', 'ju', 'jihoon', 'kim', 'taeri', 'menang', 'best', 'actor', 'best', 'actress']",netral,"[0.004008225630968809, 0.9957752823829651, 0.00021649981499649584]"
not another mul mulyono mulyani terbit mulyadi,Mon May 05 13:28:50 +0000 2025,"['not', 'another', 'mul', 'mulyono', 'mulyani', 'terbit', 'mulyadi']",netral,"[0.00010934648889815435, 0.9997691512107849, 0.00012154343858128414]"
x sibuk jawa barat dedi mulyadi ide barak militer lpa bgian negeri sumatera utara teptnya kabupaten mandailing potensi lumpur lapindo ala sumut lokasi usaha ngebor gunung rap,Mon May 05 11:20:34 +0000 2025,"['x', 'sibuk', 'jawa', 'barat', 'dedi', 'mulyadi', 'ide', 'barak', 'militer', 'lpa', 'bgian', 'negeri', 'sumatera', 'utara', 'teptnya', 'kabupaten', 'mandailing', 'potensi', 'lumpur', 'lapindo', 'ala', 'sumut', 'lokasi', 'usaha', 'ngebor', 'gunung', 'rap']",netral,"[0.00019077629258390516, 0.9996445178985596, 0.00016472801507916301]"
kang dedi mulyadi selamat,Mon May 05 14:49:43 +0000 2025,"['kang', 'dedi', 'mulyadi', 'selamat']",positif,"[0.998881995677948, 0.0008953787037171423, 0.00022265600273385644]"
kang dedi mulyadi nunggu moment nih sender nungguin dua foto bareng kim tae ri,Mon May 05 14:18:18 +0000 2025,"['kang', 'dedi', 'mulyadi', 'nunggu', 'moment', 'nih', 'sender', 'nungguin', 'dua', 'foto', 'bareng', 'kim', 'tae', 'ri']",netral,"[0.00013285550812724978, 0.9996511936187744, 0.00021595654834527522]"
main bareng kali yaaa kang dedi mulyadi,Mon May 05 14:55:51 +0000 2025,"['main', 'bareng', 'kali', 'yaaa', 'kang', 'dedi', 'mulyadi']",netral,"[0.008155491203069687, 0.990591824054718, 0.0012526307255029678]"
koi ni naritai aquarium,Mon May 05 13:00:13 +0000 2025,"['koi', 'ni', 'naritai', 'aquarium']",netral,"[0.0005120599525980651, 0.999222993850708, 0.0002648809750098735]"
lu kirim barak ikut program kang dedi mulyadi,Mon May 05 12:40:59 +0000 2025,"['lu', 'kirim', 'barak', 'ikut', 'program', 'kang', 'dedi', 'mulyadi']",netral,"[0.0001462936488678679, 0.9996914863586426, 0.00016214216884691268]"
langkah kang dedi mulyadi kirim anak bengal barak militer seems familiar txtdrgame,Mon May 05 12:31:52 +0000 2025,"['langkah', 'kang', 'dedi', 'mulyadi', 'kirim', 'anak', 'bengal', 'barak', 'militer', 'seems', 'familiar', 'txtdrgame']",netral,"[0.0001420294720446691, 0.9997217059135437, 0.00013623300765175372]"
dd prinses prnah rambut bob wktu smp btul mnangis adlh dedi krna ksihan dd rambut prinses meter potong bondol tkut rambut dd jadi sapu ijuk pdhl dd hepi ajatu,Mon May 05 13:48:02 +0000 2025,"['dd', 'prinses', 'prnah', 'rambut', 'bob', 'wktu', 'smp', 'btul', 'mnangis', 'adlh', 'dedi', 'krna', 'ksihan', 'dd', 'rambut', 'prinses', 'meter', 'potong', 'bondol', 'tkut', 'rambut', 'dd', 'jadi', 'sapu', 'ijuk', 'pdhl', 'dd', 'hepi', 'ajatu']",netral,"[0.00043921047472395003, 0.9947636127471924, 0.004797103814780712]"
siswa nakal jawa barat kirim barak liter gebenur jawa barat dedi mulyadi pakai pola liter latih calon kerja pola militer latih siswa sma kelas milik orientasi kerja program harap,Mon May 05 15:15:00 +0000 2025,"['siswa', 'nakal', 'jawa', 'barat', 'kirim', 'barak', 'liter', 'gebenur', 'jawa', 'barat', 'dedi', 'mulyadi', 'pakai', 'pola', 'liter', 'latih', 'calon', 'kerja', 'pola', 'militer', 'latih', 'siswa', 'sma', 'kelas', 'milik', 'orientasi', 'kerja', 'program', 'harap']",netral,"[9.257171041099355e-05, 0.9995291233062744, 0.00037830465589649975]"
tertawa ya orang buzzer kang dedi mulyadi miris,Mon May 05 14:29:03 +0000 2025,"['tertawa', 'ya', 'orang', 'buzzer', 'kang', 'dedi', 'mulyadi', 'miris']",negatif,"[4.497363624977879e-05, 0.00010700992424972355, 0.9998480081558228]"
subs youtube nya dedi mulyadi ratus ribu subs konten fun simpel inspiratif mantan bupati ketemu tani pedang laris tim nya ngga rubung massa kejar momen,Mon May 05 15:29:32 +0000 2025,"['subs', 'youtube', 'nya', 'dedi', 'mulyadi', 'ratus', 'ribu', 'subs', 'konten', 'fun', 'simpel', 'inspiratif', 'mantan', 'bupati', 'ketemu', 'tani', 'pedang', 'laris', 'tim', 'nya', 'ngga', 'rubung', 'massa', 'kejar', 'momen']",netral,"[0.0125143863260746, 0.9869115352630615, 0.0005740677006542683]"
uh i see mulyono mulyadi tukang ngadingadi,Mon May 05 12:58:17 +0000 2025,"['uh', 'i', 'see', 'mulyono', 'mulyadi', 'tukang', 'ngadingadi']",netral,"[9.552462870487943e-05, 0.9864060282707214, 0.013498478569090366]"
kang dedi mulyadi gubernur jawa barat,Mon May 05 14:16:45 +0000 2025,"['kang', 'dedi', 'mulyadi', 'gubernur', 'jawa', 'barat']",netral,"[0.00344438711181283, 0.9963253140449524, 0.00023026338021736592]"
kang dedi mulyadi duo dewi korea sayang,Mon May 05 13:12:01 +0000 2025,"['kang', 'dedi', 'mulyadi', 'duo', 'dewi', 'korea', 'sayang']",netral,"[0.13600601255893707, 0.8626961708068848, 0.0012978402664884925]"
kang dedi mulyadi chaerin nerima harga terima kasih iu sunbaenim bantu acting gatau bicara iu yuk yuk bicara chaerin makasih i love you iu,Mon May 05 12:37:52 +0000 2025,"['kang', 'dedi', 'mulyadi', 'chaerin', 'nerima', 'harga', 'terima', 'kasih', 'iu', 'sunbaenim', 'bantu', 'acting', 'gatau', 'bicara', 'iu', 'yuk', 'yuk', 'bicara', 'chaerin', 'makasih', 'i', 'love', 'you', 'iu']",positif,"[0.9989123344421387, 0.0008327524410560727, 0.0002549636992625892]"
omgg our beloved soljae amp wangjanim taesung kang dedi mulyadi,Mon May 05 12:38:16 +0000 2025,"['omgg', 'our', 'beloved', 'soljae', 'amp', 'wangjanim', 'taesung', 'kang', 'dedi', 'mulyadi']",netral,"[0.009547763504087925, 0.9895723462104797, 0.0008798898779787123]"
kang dedi mulyadi selamat yaa hyeyoon wooseok menang popularity awards,Mon May 05 11:53:14 +0000 2025,"['kang', 'dedi', 'mulyadi', 'selamat', 'yaa', 'hyeyoon', 'wooseok', 'menang', 'popularity', 'awards']",netral,"[0.01644604466855526, 0.9829462766647339, 0.0006077118450775743]"
kang dedi mulyadi corangtulation byeon wooseok amp kim hyeyoon popularity awards st baeksang yeyy sunjae sol ketemu,Mon May 05 12:01:27 +0000 2025,"['kang', 'dedi', 'mulyadi', 'corangtulation', 'byeon', 'wooseok', 'amp', 'kim', 'hyeyoon', 'popularity', 'awards', 'st', 'baeksang', 'yeyy', 'sunjae', 'sol', 'ketemu']",netral,"[0.0002804763207677752, 0.9995762705802917, 0.00014320315676741302]"
kang dedi mulyadi happy children day ngenalin nih merekaa,Mon May 05 12:42:23 +0000 2025,"['kang', 'dedi', 'mulyadi', 'happy', 'children', 'day', 'ngenalin', 'nih', 'merekaa']",positif,"[0.782315194606781, 0.21520303189754486, 0.002481713891029358]"
kang dedi mulyadi cung kangen wangjanim tae sung,Mon May 05 12:34:25 +0000 2025,"['kang', 'dedi', 'mulyadi', 'cung', 'kangen', 'wangjanim', 'tae', 'sung']",positif,"[0.6310815811157227, 0.3673652410507202, 0.0015532119432464242]"
kang dedi mulyadi guyss plisss kasih tau lucu iiiiiii,Mon May 05 12:12:35 +0000 2025,"['kang', 'dedi', 'mulyadi', 'guyss', 'plisss', 'kasih', 'tau', 'lucu', 'iiiiiii']",positif,"[0.9994218349456787, 0.0003693032485898584, 0.00020881211094092578]"
ahn hyoseop and nana yeorobunnnnn sexy banget nih duaduanya kang dedi mulyadi,Mon May 05 12:13:09 +0000 2025,"['ahn', 'hyoseop', 'and', 'nana', 'yeorobunnnnn', 'sexy', 'banget', 'nih', 'duaduanya', 'kang', 'dedi', 'mulyadi']",negatif,"[0.01514580100774765, 0.010516272857785225, 0.9743379354476929]"
kang dedi mulyadi mode youtuber problem solver karna kuasa anies kuasa yapping x,Mon May 05 11:02:08 +0000 2025,"['kang', 'dedi', 'mulyadi', 'mode', 'youtuber', 'problem', 'solver', 'karna', 'kuasa', 'anies', 'kuasa', 'yapping', 'x']",netral,"[0.00012810486077796668, 0.9997162222862244, 0.00015563331544399261]"
sender edit couple indigo kang dedi mulyadi the midnight studio pakai lagu youll be in my heart tag,Mon May 05 12:51:37 +0000 2025,"['sender', 'edit', 'couple', 'indigo', 'kang', 'dedi', 'mulyadi', 'the', 'midnight', 'studio', 'pakai', 'lagu', 'youll', 'be', 'in', 'my', 'heart', 'tag']",netral,"[0.0001598850212758407, 0.9996985197067261, 0.00014156951510813087]"
respons wacana program vasektomi terima bansos gubernur jawa barat dedi mulyadi mui jawa barat vasektomi haram mui jawa barat sebut vasektomi boleh syarat mui muijawabarat vasektomi bansos dedimulyadi,Mon May 05 07:11:28 +0000 2025,"['respons', 'wacana', 'program', 'vasektomi', 'terima', 'bansos', 'gubernur', 'jawa', 'barat', 'dedi', 'mulyadi', 'mui', 'jawa', 'barat', 'vasektomi', 'haram', 'mui', 'jawa', 'barat', 'sebut', 'vasektomi', 'boleh', 'syarat', 'mui', 'muijawabarat', 'vasektomi', 'bansos', 'dedimulyadi']",netral,"[0.0002849553129635751, 0.9995778203010559, 0.00013730202044826]"
bijak kang dedi mulyadi contoh bijak abah anies baswedan pro masyarakat,Mon May 05 09:48:37 +0000 2025,"['bijak', 'kang', 'dedi', 'mulyadi', 'contoh', 'bijak', 'abah', 'anies', 'baswedan', 'pro', 'masyarakat']",positif,"[0.9978291392326355, 0.0019440781325101852, 0.00022669596364721656]"
momen dedi mulyadi gubernur jawa barat sambang siswa tempuh didik barak militer markas resimen artileri sthira yudha kostrad purwakarta senin pagi giat lapang buka suasana barak tertib disiplin,Mon May 05 06:49:27 +0000 2025,"['momen', 'dedi', 'mulyadi', 'gubernur', 'jawa', 'barat', 'sambang', 'siswa', 'tempuh', 'didik', 'barak', 'militer', 'markas', 'resimen', 'artileri', 'sthira', 'yudha', 'kostrad', 'purwakarta', 'senin', 'pagi', 'giat', 'lapang', 'buka', 'suasana', 'barak', 'tertib', 'disiplin']",netral,"[0.0009121461189351976, 0.9989683628082275, 0.00011941521370317787]"
gubernur jawa barat dedi mulyadi dedimulyadi resmi larang giat study tour wisuda satu didik wilayah jawa barat md dedimulyadi laranganstudytour,Mon May 05 08:34:08 +0000 2025,"['gubernur', 'jawa', 'barat', 'dedi', 'mulyadi', 'dedimulyadi', 'resmi', 'larang', 'giat', 'study', 'tour', 'wisuda', 'satu', 'didik', 'wilayah', 'jawa', 'barat', 'md', 'dedimulyadi', 'laranganstudytour']",netral,"[0.00015589858230669051, 0.9994556307792664, 0.0003885038022417575]"
banyak orang tua sunda lihat video video anggukangguk semangat bara bilang tuju hidup kang dedi mulyadi,Mon May 05 11:37:54 +0000 2025,"['banyak', 'orang', 'tua', 'sunda', 'lihat', 'video', 'video', 'anggukangguk', 'semangat', 'bara', 'bilang', 'tuju', 'hidup', 'kang', 'dedi', 'mulyadi']",netral,"[0.019306901842355728, 0.9801008701324463, 0.0005921975243836641]"
luncur program renovasi rumah layak huni jawa barat kang dedi mulyadi target rumah tinggal layak huni,Mon May 05 08:10:00 +0000 2025,"['luncur', 'program', 'renovasi', 'rumah', 'layak', 'huni', 'jawa', 'barat', 'kang', 'dedi', 'mulyadi', 'target', 'rumah', 'tinggal', 'layak', 'huni']",netral,"[0.00041944062104448676, 0.9994797110557556, 0.00010095835023093969]"
kapolda riau wakil perwira spripim polda riau kado ulang bibit pohon iptu dedi sutarmidi senin mei,Mon May 05 08:28:06 +0000 2025,"['kapolda', 'riau', 'wakil', 'perwira', 'spripim', 'polda', 'riau', 'kado', 'ulang', 'bibit', 'pohon', 'iptu', 'dedi', 'sutarmidi', 'senin', 'mei']",netral,"[0.00010384216147940606, 0.9996829032897949, 0.00021328008733689785]"
untung gubernur kang dedi mulyadi,Mon May 05 11:03:41 +0000 2025,"['untung', 'gubernur', 'kang', 'dedi', 'mulyadi']",positif,"[0.9996472597122192, 0.00015586335211992264, 0.000196854118257761]"
langkah gubernur jawa barat dedi mulyadi kirim siswa nakal barak tni jalan bina tuai kontroversi simak lengkap aadk akun tiktok hariankompas edisi senin mei kompas mencerahkanlintasgenerasi,Mon May 05 08:56:59 +0000 2025,"['langkah', 'gubernur', 'jawa', 'barat', 'dedi', 'mulyadi', 'kirim', 'siswa', 'nakal', 'barak', 'tni', 'jalan', 'bina', 'tuai', 'kontroversi', 'simak', 'lengkap', 'aadk', 'akun', 'tiktok', 'hariankompas', 'edisi', 'senin', 'mei', 'kompas', 'mencerahkanlintasgenerasi']",netral,"[0.0004706638283096254, 0.9993135929107666, 0.00021570415992755443]"
kang dedi mulyadi tonton the tale of lady ok mari nang bareng buin sobangnim ketemu baeksang,Mon May 05 11:50:55 +0000 2025,"['kang', 'dedi', 'mulyadi', 'tonton', 'the', 'tale', 'of', 'lady', 'ok', 'mari', 'nang', 'bareng', 'buin', 'sobangnim', 'ketemu', 'baeksang']",netral,"[0.0003289551823399961, 0.9995417594909668, 0.00012933388643432409]"
kang dedi mulyadi bae suzy the baeksang icon,Mon May 05 11:22:04 +0000 2025,"['kang', 'dedi', 'mulyadi', 'bae', 'suzy', 'the', 'baeksang', 'icon']",netral,"[0.4636801779270172, 0.5348787307739258, 0.0014410940930247307]"
kang dedi mulyadi foto wajib banget muncul emg kesan banget beda pandemi duduk uji nominasi best female amp male nya nyala,Mon May 05 11:44:06 +0000 2025,"['kang', 'dedi', 'mulyadi', 'foto', 'wajib', 'banget', 'muncul', 'emg', 'kesan', 'banget', 'beda', 'pandemi', 'duduk', 'uji', 'nominasi', 'best', 'female', 'amp', 'male', 'nya', 'nyala']",positif,"[0.9993681311607361, 0.0002438532974338159, 0.00038799626054242253]"
kang dedi mulyadi ju jihoon hayoung belah moga tim trauma code foto ya,Mon May 05 11:36:44 +0000 2025,"['kang', 'dedi', 'mulyadi', 'ju', 'jihoon', 'hayoung', 'belah', 'moga', 'tim', 'trauma', 'code', 'foto', 'ya']",netral,"[0.00010771206871140748, 0.9996247291564941, 0.0002675642026588321]"
kang dedi mulyadi cantik banget mbak eunchae mbak claudia,Mon May 05 11:27:11 +0000 2025,"['kang', 'dedi', 'mulyadi', 'cantik', 'banget', 'mbak', 'eunchae', 'mbak', 'claudia']",positif,"[0.9996961355209351, 0.00014059868408367038, 0.0001632541825529188]"
jung haein red carpet baeksang looknya gin langsung lupa gimana rem karakter doi film veteran kang dedi mulyadi,Mon May 05 11:29:54 +0000 2025,"['jung', 'haein', 'red', 'carpet', 'baeksang', 'looknya', 'gin', 'langsung', 'lupa', 'gimana', 'rem', 'karakter', 'doi', 'film', 'veteran', 'kang', 'dedi', 'mulyadi']",netral,"[0.000975628849118948, 0.9987905621528625, 0.00023385343956761062]"
elite kuasa rumor ketar tir kang dedi mulyadi nyapres doi nuntut dau dana desa tambah pusat biaya programprogramnya sukses program populer kang dedi mulyadi,Mon May 05 09:43:25 +0000 2025,"['elite', 'kuasa', 'rumor', 'ketar', 'tir', 'kang', 'dedi', 'mulyadi', 'nyapres', 'doi', 'nuntut', 'dau', 'dana', 'desa', 'tambah', 'pusat', 'biaya', 'programprogramnya', 'sukses', 'program', 'populer', 'kang', 'dedi', 'mulyadi']",positif,"[0.7034903168678284, 0.2948850989341736, 0.001624574069865048]"
kang dedi mulyadi when life gives you tangerines aesun kim taeyeon aesun iu duduk deketan,Mon May 05 11:21:21 +0000 2025,"['kang', 'dedi', 'mulyadi', 'when', 'life', 'gives', 'you', 'tangerines', 'aesun', 'kim', 'taeyeon', 'aesun', 'iu', 'duduk', 'deketan']",netral,"[0.0005697939195670187, 0.9992454051971436, 0.00018483518215361983]"
guys habis nang lihat vt nya kang dedi mulyadi anak anak jual kue,Mon May 05 10:31:15 +0000 2025,"['guys', 'habis', 'nang', 'lihat', 'vt', 'nya', 'kang', 'dedi', 'mulyadi', 'anak', 'anak', 'jual', 'kue']",positif,"[0.8497069478034973, 0.11575216799974442, 0.034540850669145584]"
ken beli iphone warna pink inget kang dedi mulyadi miskin gaya,Mon May 05 11:57:09 +0000 2025,"['ken', 'beli', 'iphone', 'warna', 'pink', 'inget', 'kang', 'dedi', 'mulyadi', 'miskin', 'gaya']",negatif,"[3.7334630178520456e-05, 9.155795851256698e-05, 0.9998711347579956]"
mui ingat gubernur dedi mulyadi vasektomi haram bijak taat,Mon May 05 11:39:20 +0000 2025,"['mui', 'ingat', 'gubernur', 'dedi', 'mulyadi', 'vasektomi', 'haram', 'bijak', 'taat']",netral,"[0.00034410622902214527, 0.99953293800354, 0.00012298357614781708]"
bijak gubernur jawa barat dedi mulyadi kait kirim siswa masalah barak militer tuai prokontra respons prokontra publik dinas didik pemuda olahraga disdikpora kabupaten cianjur nilai program bina barak militer tekan,Mon May 05 10:44:40 +0000 2025,"['bijak', 'gubernur', 'jawa', 'barat', 'dedi', 'mulyadi', 'kait', 'kirim', 'siswa', 'masalah', 'barak', 'militer', 'tuai', 'prokontra', 'respons', 'prokontra', 'publik', 'dinas', 'didik', 'pemuda', 'olahraga', 'disdikpora', 'kabupaten', 'cianjur', 'nilai', 'program', 'bina', 'barak', 'militer', 'tekan']",netral,"[0.02314949408173561, 0.9750396013259888, 0.0018109679222106934]"
poin surat edar bijak dedi mulyadi larang wisuda study tour,Mon May 05 09:10:00 +0000 2025,"['poin', 'surat', 'edar', 'bijak', 'dedi', 'mulyadi', 'larang', 'wisuda', 'study', 'tour']",netral,"[0.000115010334411636, 0.9997324347496033, 0.00015254509344231337]"
