tweet,created_at,tokens,sentiment,sentiment_prob
kang dedi mulyadi the haunted palace heeii kangchul bisa nyium yeori duluan,Fri May 16 15:10:57 +0000 2025,"['kang', 'dedi', 'mulyadi', 'the', 'haunted', 'palace', 'heeii', 'kangchul', 'bisa', 'nyium', 'yeori', 'duluan']",netral,"[0.0004773081454914063, 0.9991469383239746, 0.00037576950853690505]"
luna maya kang dedi,Mon May 19 08:26:17 +0000 2025,"['luna', 'maya', 'kang', 'dedi']",positif,"[0.8749547004699707, 0.12366800010204315, 0.0013773509999737144]"
kang dedi mulyadi the haunted palace bi bi feelingnya kuat banget abang bahaya si menteri perang auto dikirimin petir bi bi,Sat May 17 07:58:52 +0000 2025,"['kang', 'dedi', 'mulyadi', 'the', 'haunted', 'palace', 'bi', 'bi', 'feelingnya', 'kuat', 'banget', 'abang', 'bahaya', 'si', 'menteri', 'perang', 'auto', 'dikirimin', 'petir', 'bi', 'bi']",positif,"[0.9121825695037842, 0.017720775678753853, 0.07009664922952652]"
resident playbook kang dedi mulyadi malam muncul sang raja drama ya guys,Sun May 18 02:23:47 +0000 2025,"['resident', 'playbook', 'kang', 'dedi', 'mulyadi', 'malam', 'muncul', 'sang', 'raja', 'drama', 'ya', 'guys']",netral,"[0.0002264777140226215, 0.9994587302207947, 0.0003147232928313315]"
kang dedi mulyadi heavenly ever after scene sender tunggu suka banget lihat interaksi hae sook pendeta asa sedih haru tuh nyampur pas tau,Tue May 20 03:24:36 +0000 2025,"['kang', 'dedi', 'mulyadi', 'heavenly', 'ever', 'after', 'scene', 'sender', 'tunggu', 'suka', 'banget', 'lihat', 'interaksi', 'hae', 'sook', 'pendeta', 'asa', 'sedih', 'haru', 'tuh', 'nyampur', 'pas', 'tau']",positif,"[0.49720877408981323, 0.050442732870578766, 0.4523484706878662]"
kang dedi mulyadi happy debut anniversary byeon wooseok suka wooseok peran karakter dramamovies guys,Mon May 12 14:27:42 +0000 2025,"['kang', 'dedi', 'mulyadi', 'happy', 'debut', 'anniversary', 'byeon', 'wooseok', 'suka', 'wooseok', 'peran', 'karakter', 'dramamovies', 'guys']",netral,"[0.001224508392624557, 0.9986372590065002, 0.0001382297050440684]"
kang dedi mulyadi resident playbook aaaaaa galau berat last episode tunggu jatohnya karir drmyeongsemoga bongkar yahhh pasang idol fans pacar plisss,Sun May 18 11:13:15 +0000 2025,"['kang', 'dedi', 'mulyadi', 'resident', 'playbook', 'aaaaaa', 'galau', 'berat', 'last', 'episode', 'tunggu', 'jatohnya', 'karir', 'drmyeongsemoga', 'bongkar', 'yahhh', 'pasang', 'idol', 'fans', 'pacar', 'plisss']",negatif,"[0.00010685893357731402, 0.00019059368059970438, 0.999702513217926]"
kang dedi mulyadi cast film horor salmokji udah rasa horor ges cr myemye,Mon May 12 12:18:27 +0000 2025,"['kang', 'dedi', 'mulyadi', 'cast', 'film', 'horor', 'salmokji', 'udah', 'rasa', 'horor', 'ges', 'cr', 'myemye']",netral,"[0.0006183931254781783, 0.9977627992630005, 0.0016187528381124139]"
kang dedi mulyadi na baekjin amp geum seongje,Mon May 19 11:23:00 +0000 2025,"['kang', 'dedi', 'mulyadi', 'na', 'baekjin', 'amp', 'geum', 'seongje']",netral,"[0.0005554451490752399, 0.9992256164550781, 0.0002189630758948624]"
kang dedi mulyadi resident playbook what if ngga dobrak myeong oh pesawat aaaa ngayunin sendok gu nyamnyam massiseo uri yiyoung oh mauuu aegyo gu pesawat aaaa oh hmmm massiseo gu kiyowookk full aegyo cubit yiyoung,Tue May 13 04:15:54 +0000 2025,"['kang', 'dedi', 'mulyadi', 'resident', 'playbook', 'what', 'if', 'ngga', 'dobrak', 'myeong', 'oh', 'pesawat', 'aaaa', 'ngayunin', 'sendok', 'gu', 'nyamnyam', 'massiseo', 'uri', 'yiyoung', 'oh', 'mauuu', 'aegyo', 'gu', 'pesawat', 'aaaa', 'oh', 'hmmm', 'massiseo', 'gu', 'kiyowookk', 'full', 'aegyo', 'cubit', 'yiyoung']",netral,"[0.0012715152697637677, 0.9583381414413452, 0.04039030149579048]"
dankormar mayje tni mar endi supardi hadir damping gubernur jawa barat kang dedi mulyadi program abdi nagri nganjang ka warga edisi gelar lapang bola desa panjalin kidul sumberjaya majalengka rabu,Thu May 22 01:30:28 +0000 2025,"['dankormar', 'mayje', 'tni', 'mar', 'endi', 'supardi', 'hadir', 'damping', 'gubernur', 'jawa', 'barat', 'kang', 'dedi', 'mulyadi', 'program', 'abdi', 'nagri', 'nganjang', 'ka', 'warga', 'edisi', 'gelar', 'lapang', 'bola', 'desa', 'panjalin', 'kidul', 'sumberjaya', 'majalengka', 'rabu']",netral,"[0.00016519853670615703, 0.9995805621147156, 0.0002543272275943309]"
kang dedi mulyadi sender aktor vibe bawa klean tuju gaes,Wed May 21 12:18:06 +0000 2025,"['kang', 'dedi', 'mulyadi', 'sender', 'aktor', 'vibe', 'bawa', 'klean', 'tuju', 'gaes']",netral,"[0.00014734530122950673, 0.9996503591537476, 0.00020231347298249602]"
kang dedi mulyadi shin sia cantik banget gatau ngelihat langsung keinget suzy visual inget suzy foto video sia muncul,Thu May 15 15:37:08 +0000 2025,"['kang', 'dedi', 'mulyadi', 'shin', 'sia', 'cantik', 'banget', 'gatau', 'ngelihat', 'langsung', 'keinget', 'suzy', 'visual', 'inget', 'suzy', 'foto', 'video', 'sia', 'muncul']",positif,"[0.9994186162948608, 0.0002388306602369994, 0.00034249824238941073]"
kang dedi mulyadi residen playbook jaeil nih orang friendly perhati banget orang diperhatiin laku perhati sabi beda banding tingkah sabi bikin senyumsenyum saking gemesnya,Wed May 21 13:29:22 +0000 2025,"['kang', 'dedi', 'mulyadi', 'residen', 'playbook', 'jaeil', 'nih', 'orang', 'friendly', 'perhati', 'banget', 'orang', 'diperhatiin', 'laku', 'perhati', 'sabi', 'beda', 'banding', 'tingkah', 'sabi', 'bikin', 'senyumsenyum', 'saking', 'gemesnya']",positif,"[0.9995098114013672, 0.0002618394501041621, 0.00022831466048955917]"
merinding banget denger cerita seolaholah tinggal titip keluarga kang dedi mulyadi,Sat May 17 16:25:44 +0000 2025,"['merinding', 'banget', 'denger', 'cerita', 'seolaholah', 'tinggal', 'titip', 'keluarga', 'kang', 'dedi', 'mulyadi']",positif,"[0.8502108454704285, 0.1417694389820099, 0.008019689470529556]"
kencang duit kang dedi mulyadi nyapres lokasi jambi foto budibukanintel,Fri May 16 03:52:39 +0000 2025,"['kencang', 'duit', 'kang', 'dedi', 'mulyadi', 'nyapres', 'lokasi', 'jambi', 'foto', 'budibukanintel']",netral,"[0.00033009605249390006, 0.9995020627975464, 0.00016793815302662551]"
gaakan kejut gebrak kang dedi mulyadi aktion t,Tue Apr 29 03:15:47 +0000 2025,"['gaakan', 'kejut', 'gebrak', 'kang', 'dedi', 'mulyadi', 'aktion', 't']",netral,"[0.00021922591258771718, 0.9995877146720886, 0.00019307818729430437]"
block mute nih bala bala kang dedi mulyadi,Wed Apr 30 05:01:38 +0000 2025,"['block', 'mute', 'nih', 'bala', 'bala', 'kang', 'dedi', 'mulyadi']",negatif,"[0.00027373566990718246, 0.004647838417440653, 0.995078444480896]"
kang dedi mulyadi resident playbook coba drop meme relate banget reaksi lihat couple bulol bikin merinding lovingly alias gu dowonoh yiyoung episode sender first,Wed May 14 01:36:19 +0000 2025,"['kang', 'dedi', 'mulyadi', 'resident', 'playbook', 'coba', 'drop', 'meme', 'relate', 'banget', 'reaksi', 'lihat', 'couple', 'bulol', 'bikin', 'merinding', 'lovingly', 'alias', 'gu', 'dowonoh', 'yiyoung', 'episode', 'sender', 'first']",netral,"[0.0025153830647468567, 0.9969713687896729, 0.0005131638026796281]"
kang dedi mulyadi h smp ketemu soobin wooseok uhuyyy whos excited,Wed May 14 01:09:36 +0000 2025,"['kang', 'dedi', 'mulyadi', 'h', 'smp', 'ketemu', 'soobin', 'wooseok', 'uhuyyy', 'whos', 'excited']",positif,"[0.9988207221031189, 0.0008429072913713753, 0.0003364268923178315]"
kang dedi mulyadi drama haein bagus tarik tonton,Thu May 15 02:43:06 +0000 2025,"['kang', 'dedi', 'mulyadi', 'drama', 'haein', 'bagus', 'tarik', 'tonton']",positif,"[0.9996721744537354, 0.00012094210251234472, 0.00020690033852588385]"
the great queen seondeok kang dedi mulyadi gaes nanya misil dukung cheon myeong ratu jaman emg cewe ratu raja cheon myeong manggil misil nona misil suri ya,Sat May 17 11:05:44 +0000 2025,"['the', 'great', 'queen', 'seondeok', 'kang', 'dedi', 'mulyadi', 'gaes', 'nanya', 'misil', 'dukung', 'cheon', 'myeong', 'ratu', 'jaman', 'emg', 'cewe', 'ratu', 'raja', 'cheon', 'myeong', 'manggil', 'misil', 'nona', 'misil', 'suri', 'ya']",netral,"[0.0019253211794421077, 0.9950206279754639, 0.003053992986679077]"
kang dedi mulyadi when life gives you tangerines sender sempet lihat sender haru banget lihat scene park chung seop kejar bus ketemu geum myeong kirain nyerah,Tue May 13 14:22:21 +0000 2025,"['kang', 'dedi', 'mulyadi', 'when', 'life', 'gives', 'you', 'tangerines', 'sender', 'sempet', 'lihat', 'sender', 'haru', 'banget', 'lihat', 'scene', 'park', 'chung', 'seop', 'kejar', 'bus', 'ketemu', 'geum', 'myeong', 'kirain', 'nyerah']",positif,"[0.6146016716957092, 0.37482863664627075, 0.010569694451987743]"
dedi mulyadi tolak bapakbapak beli karung milik gimana turut gais,Thu May 15 01:42:59 +0000 2025,"['dedi', 'mulyadi', 'tolak', 'bapakbapak', 'beli', 'karung', 'milik', 'gimana', 'turut', 'gais']",netral,"[9.97420065687038e-05, 0.9995379447937012, 0.00036229443503543735]"
populer grassroot rangin foto bareng anak abah sipaling sobat literasi sipaling mental health sipaling performative activism banyakin foto bareng tani nelayan kuli dll kang dedi mulyadi,Mon May 19 00:41:47 +0000 2025,"['populer', 'grassroot', 'rangin', 'foto', 'bareng', 'anak', 'abah', 'sipaling', 'sobat', 'literasi', 'sipaling', 'mental', 'health', 'sipaling', 'performative', 'activism', 'banyakin', 'foto', 'bareng', 'tani', 'nelayan', 'kuli', 'dll', 'kang', 'dedi', 'mulyadi']",netral,"[0.28558608889579773, 0.7129460573196411, 0.0014679005835205317]"
bareng warga hujat ikut pas nyerang kang dedi mulyadi wkkwkw,Wed May 21 13:43:15 +0000 2025,"['bareng', 'warga', 'hujat', 'ikut', 'pas', 'nyerang', 'kang', 'dedi', 'mulyadi', 'wkkwkw']",netral,"[0.0005710215191356838, 0.9987002611160278, 0.0007287078187800944]"
untuk anakanak main hape awas lho tar ambil dedi,Mon May 12 00:40:47 +0000 2025,"['untuk', 'anakanak', 'main', 'hape', 'awas', 'lho', 'tar', 'ambil', 'dedi']",netral,"[0.0001755505072651431, 0.9994205236434937, 0.0004040340718347579]"
resident playbook duo selamat kim sabi episode sayang banget prof ryu amp uhm jaeil in the world of men they re gentleman kagum prof ryu karna kesini karakter kang dedi mulyadi,Mon May 12 00:42:38 +0000 2025,"['resident', 'playbook', 'duo', 'selamat', 'kim', 'sabi', 'episode', 'sayang', 'banget', 'prof', 'ryu', 'amp', 'uhm', 'jaeil', 'in', 'the', 'world', 'of', 'men', 'they', 're', 'gentleman', 'kagum', 'prof', 'ryu', 'karna', 'kesini', 'karakter', 'kang', 'dedi', 'mulyadi']",positif,"[0.9996709823608398, 0.00015549261297564954, 0.00017356895841658115]"
saran drama umjay kang dedi mulyadi resident playbook,Mon May 12 01:09:18 +0000 2025,"['saran', 'drama', 'umjay', 'kang', 'dedi', 'mulyadi', 'resident', 'playbook']",netral,"[0.0003327194426674396, 0.9994910955429077, 0.00017624280008021742]"
kang dedi mulyadi chemistry oke akting oke suruh gambar mwehehehe,Mon May 12 01:08:01 +0000 2025,"['kang', 'dedi', 'mulyadi', 'chemistry', 'oke', 'akting', 'oke', 'suruh', 'gambar', 'mwehehehe']",netral,"[0.0051553379744291306, 0.9714546203613281, 0.02339000068604946]"
tunggu perang dunia shinobi uchiha cok dedi mulyadi senju,Mon May 12 15:05:47 +0000 2025,"['tunggu', 'perang', 'dunia', 'shinobi', 'uchiha', 'cok', 'dedi', 'mulyadi', 'senju']",netral,"[0.00011623112368397415, 0.9996652603149414, 0.00021852567442692816]"
gibran tinjau bangun bendung ntt kang dedi mulyadi urus jawa barat amat ngajari beginibegitu utas,Mon May 12 00:51:32 +0000 2025,"['gibran', 'tinjau', 'bangun', 'bendung', 'ntt', 'kang', 'dedi', 'mulyadi', 'urus', 'jawa', 'barat', 'amat', 'ngajari', 'beginibegitu', 'utas']",netral,"[0.0005850932793691754, 0.9991664886474609, 0.00024849368492141366]"
kang dedi mulyadi guys tolong rate kasih review film thank youuu,Mon May 12 14:32:25 +0000 2025,"['kang', 'dedi', 'mulyadi', 'guys', 'tolong', 'rate', 'kasih', 'review', 'film', 'thank', 'youuu']",netral,"[0.00040915131103247404, 0.9993239641189575, 0.00026682662428356707]"
kang dedi mulyadi resident playbook mama papa,Sun May 11 13:24:09 +0000 2025,"['kang', 'dedi', 'mulyadi', 'resident', 'playbook', 'mama', 'papa']",netral,"[0.0001878302573459223, 0.999636173248291, 0.00017595078679732978]"
resident playbook kang dedi mulyadi aaakkk youngwon tau jaeil gaes mingdep ricuh mah,Sun May 11 13:48:03 +0000 2025,"['resident', 'playbook', 'kang', 'dedi', 'mulyadi', 'aaakkk', 'youngwon', 'tau', 'jaeil', 'gaes', 'mingdep', 'ricuh', 'mah']",netral,"[0.00027559633599594235, 0.9226903319358826, 0.07703394442796707]"
resident playbook kang dedi mulyadi dowon oppaaa dowon mengsalting aduh aduh pacar,Sun May 11 12:55:29 +0000 2025,"['resident', 'playbook', 'kang', 'dedi', 'mulyadi', 'dowon', 'oppaaa', 'dowon', 'mengsalting', 'aduh', 'aduh', 'pacar']",netral,"[9.376805974170566e-05, 0.9995505213737488, 0.0003556689771357924]"
resident playbook kang dedi mulyadi aaakk ikjun songhwaaa ikjun nih muncul gabisa normal ya kepala tangan,Sun May 11 13:18:21 +0000 2025,"['resident', 'playbook', 'kang', 'dedi', 'mulyadi', 'aaakk', 'ikjun', 'songhwaaa', 'ikjun', 'nih', 'muncul', 'gabisa', 'normal', 'ya', 'kepala', 'tangan']",netral,"[0.0003643606323748827, 0.9985539317131042, 0.0010817033471539617]"
resident playbook kang dedi mulyadi gajadi suap gangguin,Sun May 11 13:19:48 +0000 2025,"['resident', 'playbook', 'kang', 'dedi', 'mulyadi', 'gajadi', 'suap', 'gangguin']",netral,"[7.465205271728337e-05, 0.9993170499801636, 0.0006082110339775681]"
kang dedi mulyadi resident playbook persnackan rival,Sun May 11 13:04:52 +0000 2025,"['kang', 'dedi', 'mulyadi', 'resident', 'playbook', 'persnackan', 'rival']",netral,"[0.0001790613168850541, 0.9996287822723389, 0.00019206372962798923]"
gen zalpha tau kang dedi mulyadi,Sun May 11 12:45:55 +0000 2025,"['gen', 'zalpha', 'tau', 'kang', 'dedi', 'mulyadi']",positif,"[0.9986975193023682, 0.001058096531778574, 0.0002442802069708705]"
kang dedi mulyadi kim jiwon nyanyi dance jago bahasa inggris amp jepang india ya ytta akting ragu gambar maaf guys sender kangen nih cewe cr zialxx,Sun May 11 13:48:34 +0000 2025,"['kang', 'dedi', 'mulyadi', 'kim', 'jiwon', 'nyanyi', 'dance', 'jago', 'bahasa', 'inggris', 'amp', 'jepang', 'india', 'ya', 'ytta', 'akting', 'ragu', 'gambar', 'maaf', 'guys', 'sender', 'kangen', 'nih', 'cewe', 'cr', 'zialxx']",netral,"[0.01848469115793705, 0.975951075553894, 0.005564164835959673]"
kang dedi mulyadi mba moon chaewon ig update suka beliau jga info cb drama guys,Sun May 11 12:52:52 +0000 2025,"['kang', 'dedi', 'mulyadi', 'mba', 'moon', 'chaewon', 'ig', 'update', 'suka', 'beliau', 'jga', 'info', 'cb', 'drama', 'guys']",positif,"[0.9995538592338562, 0.00024215987650677562, 0.00020401495567057282]"
kisah anak lawan chaebol psikopat nama nam gyuman kang dedi mulyadi hasil tamat episode drama ter asdfghjkl masa,Sun May 11 13:00:23 +0000 2025,"['kisah', 'anak', 'lawan', 'chaebol', 'psikopat', 'nama', 'nam', 'gyuman', 'kang', 'dedi', 'mulyadi', 'hasil', 'tamat', 'episode', 'drama', 'ter', 'asdfghjkl', 'masa']",netral,"[0.00012419918493833393, 0.9995611310005188, 0.00031469640089198947]"
kang dedi mulyadi guysss lee jong suk ngelike postinga um jay sabi dance challenge,Sun May 11 11:36:43 +0000 2025,"['kang', 'dedi', 'mulyadi', 'guysss', 'lee', 'jong', 'suk', 'ngelike', 'postinga', 'um', 'jay', 'sabi', 'dance', 'challenge']",netral,"[0.00019163043180014938, 0.9996209144592285, 0.0001874465961009264]"
bijak kang dedi mulyadi didik barak,Sun May 11 09:22:18 +0000 2025,"['bijak', 'kang', 'dedi', 'mulyadi', 'didik', 'barak']",positif,"[0.998047947883606, 0.0016004623612388968, 0.00035151877091266215]"
coba drop squad kang dedi mulyadi fav sender first law school squad pas dateng musikal kimbum,Sun May 11 11:37:12 +0000 2025,"['coba', 'drop', 'squad', 'kang', 'dedi', 'mulyadi', 'fav', 'sender', 'first', 'law', 'school', 'squad', 'pas', 'dateng', 'musikal', 'kimbum']",netral,"[0.00022526714019477367, 0.9996132254600525, 0.0001616382214706391]"
binakuran nila ang isat isa haha ashdres,Sun May 11 07:11:35 +0000 2025,"['binakuran', 'nila', 'ang', 'isat', 'isa', 'haha', 'ashdres']",netral,"[0.0036492380313575268, 0.9867603778839111, 0.009590336121618748]"
resident playbook kang dedi mulyadi sabi tonton ep paham kemarin malu banget pas kentut,Sun May 11 10:49:42 +0000 2025,"['resident', 'playbook', 'kang', 'dedi', 'mulyadi', 'sabi', 'tonton', 'ep', 'paham', 'kemarin', 'malu', 'banget', 'pas', 'kentut']",negatif,"[5.855685958522372e-05, 0.0004985156701877713, 0.9994428753852844]"
dukung kang dedi mulyadi,Sun May 11 07:13:00 +0000 2025,"['dukung', 'kang', 'dedi', 'mulyadi']",positif,"[0.9935505390167236, 0.006023352965712547, 0.0004260066489223391]"
kang dedi mulyadi spring of youth line x couple versi muda main lead line x main couple lihat drama ntflix suka banget cerita padu extraordinary you x lovely runner x twinkling watermelon,Sun May 11 11:38:26 +0000 2025,"['kang', 'dedi', 'mulyadi', 'spring', 'of', 'youth', 'line', 'x', 'couple', 'versi', 'muda', 'main', 'lead', 'line', 'x', 'main', 'couple', 'lihat', 'drama', 'ntflix', 'suka', 'banget', 'cerita', 'padu', 'extraordinary', 'you', 'x', 'lovely', 'runner', 'x', 'twinkling', 'watermelon']",positif,"[0.9996391534805298, 0.00018913815438281745, 0.00017167048645205796]"
kasihan kang dedi mulyadi jadi senjata mak idola,Sun May 11 11:02:14 +0000 2025,"['kasihan', 'kang', 'dedi', 'mulyadi', 'jadi', 'senjata', 'mak', 'idola']",negatif,"[3.614679735619575e-05, 9.80936165433377e-05, 0.9998657703399658]"
kang dedi mulyadi resident playbook gyosunim hosplay nama geng z squad residen nama,Sun May 11 09:26:16 +0000 2025,"['kang', 'dedi', 'mulyadi', 'resident', 'playbook', 'gyosunim', 'hosplay', 'nama', 'geng', 'z', 'squad', 'residen', 'nama']",netral,"[0.00016203463019337505, 0.9996002316474915, 0.00023776922898832709]"
titip guys drakor ttg hubung mantan pacar putus tuh nyakitin bgtbgtbgt pacar spill judul thx kang dedi mulyadi,Sun May 11 09:24:53 +0000 2025,"['titip', 'guys', 'drakor', 'ttg', 'hubung', 'mantan', 'pacar', 'putus', 'tuh', 'nyakitin', 'bgtbgtbgt', 'pacar', 'spill', 'judul', 'thx', 'kang', 'dedi', 'mulyadi']",netral,"[0.00011766731040552258, 0.9995595812797546, 0.00032281133462674916]"
frimawan main sketsa neng dicky anak pentol maskulin banget brooo kang dedi mulyadi anak nakal kirim barak barak wendi langsung masuk watchlist malem,Sun May 11 09:15:59 +0000 2025,"['frimawan', 'main', 'sketsa', 'neng', 'dicky', 'anak', 'pentol', 'maskulin', 'banget', 'brooo', 'kang', 'dedi', 'mulyadi', 'anak', 'nakal', 'kirim', 'barak', 'barak', 'wendi', 'langsung', 'masuk', 'watchlist', 'malem']",negatif,"[0.00025959109188988805, 0.13188420236110687, 0.8678562045097351]"
lihat lovers of the red sky baguss bangett cerita chemistry yoo jung ahn hyo seop ahn hyo seop akting bagus banget yoo jung lagi ubi nada dering kang dedi mulyadi,Sun May 11 09:07:08 +0000 2025,"['lihat', 'lovers', 'of', 'the', 'red', 'sky', 'baguss', 'bangett', 'cerita', 'chemistry', 'yoo', 'jung', 'ahn', 'hyo', 'seop', 'ahn', 'hyo', 'seop', 'akting', 'bagus', 'banget', 'yoo', 'jung', 'lagi', 'ubi', 'nada', 'dering', 'kang', 'dedi', 'mulyadi']",positif,"[0.9994714856147766, 0.00029579346301034093, 0.00023265925119630992]"
verrell tantang asuh anak nakal protes bijak gubernur jawa barat dedi mulyadi masukin anak nakal barak,Sun May 11 05:09:07 +0000 2025,"['verrell', 'tantang', 'asuh', 'anak', 'nakal', 'protes', 'bijak', 'gubernur', 'jawa', 'barat', 'dedi', 'mulyadi', 'masukin', 'anak', 'nakal', 'barak']",netral,"[6.41403385088779e-05, 0.9976366758346558, 0.0022992321755737066]"
kang dedi mulyadi jung junwon instagram update ingatin lihat resident playbook malam,Sun May 11 06:37:05 +0000 2025,"['kang', 'dedi', 'mulyadi', 'jung', 'junwon', 'instagram', 'update', 'ingatin', 'lihat', 'resident', 'playbook', 'malam']",netral,"[0.00016896301531232893, 0.9995866417884827, 0.0002443617850076407]"
kang dedi mulyadi the haunted palace emang raja ganteng,Sun May 11 07:41:47 +0000 2025,"['kang', 'dedi', 'mulyadi', 'the', 'haunted', 'palace', 'emang', 'raja', 'ganteng']",positif,"[0.9991683959960938, 0.0005572546506300569, 0.00027438675169833004]"
kang dedi terimakasih perhati kerja deh tugas selesai tanggung,Sun May 11 05:29:25 +0000 2025,"['kang', 'dedi', 'terimakasih', 'perhati', 'kerja', 'deh', 'tugas', 'selesai', 'tanggung']",positif,"[0.9974874258041382, 0.002012374810874462, 0.0005001291865482926]"
kang dedi mulyadi masukin barak,Sun May 11 05:56:42 +0000 2025,"['kang', 'dedi', 'mulyadi', 'masukin', 'barak']",netral,"[0.00016213589697144926, 0.9995699524879456, 0.00026785407681018114]"
kang dedi mulyadi akhirnyaaa foto dear x main squad kim youjung kim youngdae kim dohoon lee yuleum,Sun May 11 05:54:47 +0000 2025,"['kang', 'dedi', 'mulyadi', 'akhirnyaaa', 'foto', 'dear', 'x', 'main', 'squad', 'kim', 'youjung', 'kim', 'youngdae', 'kim', 'dohoon', 'lee', 'yuleum']",netral,"[0.00015574664575979114, 0.9996383190155029, 0.00020589107589330524]"
kang dedi mulyadi the haunted palace sih ngide rambut bang raja diberantakin ganteng nambah pliss btw info nglamar selir gess,Sun May 11 08:17:44 +0000 2025,"['kang', 'dedi', 'mulyadi', 'the', 'haunted', 'palace', 'sih', 'ngide', 'rambut', 'bang', 'raja', 'diberantakin', 'ganteng', 'nambah', 'pliss', 'btw', 'info', 'nglamar', 'selir', 'gess']",negatif,"[0.19086088240146637, 0.17802774906158447, 0.6311114430427551]"
guyss udah lihat taxi driver s sedia isi kuesioner ta ku ngga butuh responden fyi reward ewallet tolong rep ya kirimin linknya kang dedi mulyadi,Sun May 11 07:43:00 +0000 2025,"['guyss', 'udah', 'lihat', 'taxi', 'driver', 's', 'sedia', 'isi', 'kuesioner', 'ta', 'ku', 'ngga', 'butuh', 'responden', 'fyi', 'reward', 'ewallet', 'tolong', 'rep', 'ya', 'kirimin', 'linknya', 'kang', 'dedi', 'mulyadi']",netral,"[0.00018806997104547918, 0.9996460676193237, 0.00016590343147981912]"
kang dedi mulyadi resident playbook gambar yikyung,Sun May 11 05:30:51 +0000 2025,"['kang', 'dedi', 'mulyadi', 'resident', 'playbook', 'gambar', 'yikyung']",netral,"[0.00017124213627539575, 0.9996423721313477, 0.00018634216394275427]"
kang dedi mulyadi resident playbook hi my boys hi hello girls fanboynya manggil panggil gaes,Sun May 11 05:31:58 +0000 2025,"['kang', 'dedi', 'mulyadi', 'resident', 'playbook', 'hi', 'my', 'boys', 'hi', 'hello', 'girls', 'fanboynya', 'manggil', 'panggil', 'gaes']",netral,"[9.244222746929154e-05, 0.9996485710144043, 0.00025890854885801673]"
kang dedi mulyadi resident playbook saking nugu nya member pindah agens sukses debut membernya banting stir dokter,Sun May 11 05:08:46 +0000 2025,"['kang', 'dedi', 'mulyadi', 'resident', 'playbook', 'saking', 'nugu', 'nya', 'member', 'pindah', 'agens', 'sukses', 'debut', 'membernya', 'banting', 'stir', 'dokter']",netral,"[0.1088109239935875, 0.6743377447128296, 0.2168513536453247]"
kang dedi mulyadi nguap bareng bisabisa tonton sedot layar,Sun May 11 05:44:59 +0000 2025,"['kang', 'dedi', 'mulyadi', 'nguap', 'bareng', 'bisabisa', 'tonton', 'sedot', 'layar']",netral,"[0.00021531039965339005, 0.9995424747467041, 0.00024225089873652905]"
kang dedi mulyadi resident playbook kaya tonton udah nebak sih love line sabi jaeil expect sabi sampe tahap ngefans berat udah nebak gin kah,Sun May 11 05:19:43 +0000 2025,"['kang', 'dedi', 'mulyadi', 'resident', 'playbook', 'kaya', 'tonton', 'udah', 'nebak', 'sih', 'love', 'line', 'sabi', 'jaeil', 'expect', 'sabi', 'sampe', 'tahap', 'ngefans', 'berat', 'udah', 'nebak', 'gin', 'kah']",negatif,"[0.00034704472636803985, 0.0008495221845805645, 0.9988033771514893]"
kang dedi mulyadi suksesor prabs lawan prabs saking takut nya lawan berat abah udah serang,Sun May 11 07:03:08 +0000 2025,"['kang', 'dedi', 'mulyadi', 'suksesor', 'prabs', 'lawan', 'prabs', 'saking', 'takut', 'nya', 'lawan', 'berat', 'abah', 'udah', 'serang']",negatif,"[0.0015160000184550881, 0.003253686474636197, 0.9952303171157837]"
kang dedi mulyadi resident playbook tuh dowon yiyoung pegang tangan anjrit bucin bat lu berduaaa dah suap suap pegang tangan pulak inimah cinta tonton kalah kebucinan,Sun May 11 03:59:24 +0000 2025,"['kang', 'dedi', 'mulyadi', 'resident', 'playbook', 'tuh', 'dowon', 'yiyoung', 'pegang', 'tangan', 'anjrit', 'bucin', 'bat', 'lu', 'berduaaa', 'dah', 'suap', 'suap', 'pegang', 'tangan', 'pulak', 'inimah', 'cinta', 'tonton', 'kalah', 'kebucinan']",positif,"[0.9170957803726196, 0.02586725726723671, 0.05703699588775635]"
kang dedi mulyadi pecah perhati haters jokowi amp grr master mindnya usaha algoritma medsos kait tiga signifikan bahu bahu nusantara maju,Sun May 11 03:42:53 +0000 2025,"['kang', 'dedi', 'mulyadi', 'pecah', 'perhati', 'haters', 'jokowi', 'amp', 'grr', 'master', 'mindnya', 'usaha', 'algoritma', 'medsos', 'kait', 'tiga', 'signifikan', 'bahu', 'bahu', 'nusantara', 'maju']",netral,"[0.011590417474508286, 0.9880034923553467, 0.00040615827310830355]"
serang masif kang dedi mulyadi barak militer ajar disiplin bangun pagi sih kamar hidup atur sopan santun skill dasar orang tua serah ajar anak ajar perang lempar granat nembak basoka,Sun May 11 00:48:02 +0000 2025,"['serang', 'masif', 'kang', 'dedi', 'mulyadi', 'barak', 'militer', 'ajar', 'disiplin', 'bangun', 'pagi', 'sih', 'kamar', 'hidup', 'atur', 'sopan', 'santun', 'skill', 'dasar', 'orang', 'tua', 'serah', 'ajar', 'anak', 'ajar', 'perang', 'lempar', 'granat', 'nembak', 'basoka']",negatif,"[0.00015812373021617532, 0.02596968039870262, 0.973872184753418]"
susah mandi tidur berangkat sekolah bawa dedi mulyadi hayoo,Sun May 11 02:33:26 +0000 2025,"['susah', 'mandi', 'tidur', 'berangkat', 'sekolah', 'bawa', 'dedi', 'mulyadi', 'hayoo']",negatif,"[5.074614455224946e-05, 0.00023449301079381257, 0.9997147917747498]"
kang dedi mulyadi produksi gorong gorong citra jokowi jokowi jokowi musuh tolakujivaksingates kang dedi musuh tolakpuslabforujiforensik,Sun May 11 03:36:23 +0000 2025,"['kang', 'dedi', 'mulyadi', 'produksi', 'gorong', 'gorong', 'citra', 'jokowi', 'jokowi', 'jokowi', 'musuh', 'tolakujivaksingates', 'kang', 'dedi', 'musuh', 'tolakpuslabforujiforensik']",negatif,"[0.0082926694303751, 0.025750137865543365, 0.9659572243690491]"
